_id,name,description,color,icon,displayOrder
cat001,Workshop,Hands-on sessions where participants work on their own trees with guidance from an instructor.,#D4A574,🌿,1
cat002,Meeting,"Regular club meetings featuring demonstrations, guest speakers, and community discussions.",#6B8E6F,👥,2
cat003,Clinic,Focused sessions where members can bring their trees for specific advice and diagnosis.,#8B7355,🩺,3
cat004,Exhibition,Public shows displaying the finest trees from our members and the community.,#4A4A4A,🏆,4
cat005,Social,"Informal get-togethers, picnics, and other community-building events.",#5BC0DE,🎉,5